{
  "name": "cap-mandate-broker",
  "layer": "cap",
  "wave": 4,
  "description": "The mandate and credential brokering contract: an actor exchanges its identity for a short-lived authority bound to one destination, or for a signed, expiring, scope-limited mandate to take one bounded action, and neither the key nor the token ever reaches the unit of work. Load it whenever something inside a sandbox needs to reach something outside it, before any component is given an API key, a cloud credential or a database password, when an action is irreversible - money moves, a deploy lands, a message is sent - and someone has to be able to check afterwards that it was authorised, when a token has to be accepted by one destination and refused by another, when someone asks 'where does the real key live', 'what stops this token being replayed somewhere else', 'how does a partner check this without asking us', or 'who approved this spend', and before any design lets a long-lived secret into a running agent.",
  "purpose": {
    "text": "Fix one contract for minting authority: a short-lived, destination-bound credential for reaching something, and a signed, expiring, scope-limited mandate for doing something irreversible, so the core imports minting and verification while the key store, the token service and the credential format stay adapter detail.",
    "origin": "sourced",
    "sources": [
      "F-b1-02",
      "X-cap-mandate-broker-007"
    ],
    "quote": "ensuring the agent never holds the credential"
  },
  "entities": [
    "E-standard-oauth-2-0-token-exchange",
    "E-standard-model-context-protocol",
    "E-sandbox-property-guest-credential",
    "E-sandbox-property-model-egress",
    "E-sandbox-property-field-filtering"
  ],
  "contract": {
    "standards": [
      {
        "entity": "E-standard-oauth-2-0-token-exchange",
        "version": "unverified",
        "version_note": "the record on file says the token-exchange RFC was published in January 2020, and it is search-only rather than fetched, so no version of the exchange profile this interface uses is asserted here",
        "version_status": "unverified",
        "url": "https://www.ietf.org/rfc/rfc8693.pdf",
        "sources": [
          "F-b3-14",
          "X-cap-mandate-broker-001",
          "X-cap-mandate-broker-002"
        ]
      },
      {
        "entity": "E-standard-model-context-protocol",
        "version": "unverified",
        "version_note": "the manifest records the authorization revision 2025-11-25 together with the resource-indicators RFC; both records on file are search-only and neither is the specification text, so no revision string is asserted here",
        "version_status": "unverified",
        "url": "https://modelcontextprotocol.io/specification/2025-11-25/basic/authorization",
        "sources": [
          "F-b3-06",
          "X-end-to-end-028",
          "X-cap-mandate-broker-003"
        ]
      },
      {
        "entity": "E-standard-w3c-verifiable-credentials",
        "version": "unverified",
        "version_note": "proposed entity id and version unverified: PASS.md B3 carries no mandate or credential-brokering row, so kb/entities.jsonl holds no entity for this standard and none may be added without rewriting the entity chain every written skill pins; both records on file are search-only, so no version is asserted here",
        "version_status": "unverified",
        "url": "https://docs.walt.id/concepts/digital-credentials/verifiable-credentials-w3c",
        "sources": [
          "X-cap-mandate-broker-005",
          "X-end-to-end-070"
        ]
      }
    ],
    "operations": [
      {
        "name": "mint",
        "input": "an actor subject with its delegation chain, exactly one destination identifier, a requested scope, and a lifetime",
        "output": "a handle to a credential bound to that one destination as its audience and expiring with the task; the credential bytes are never returned to the caller and never written where the unit of work can read them",
        "origin": "sourced",
        "sources": [
          "X-cap-mandate-broker-006"
        ],
        "quote": "Short-lived agent sessions are derived from the user session at task start with minutes in TTL and are non-refreshable by design"
      },
      {
        "name": "exchange",
        "input": "a token naming the delegating actor, a token naming the acting agent, and the destination and scope wanted for the next hop",
        "output": "a token for that destination whose scope is no wider than the input's; a request that would widen scope is refused rather than granted",
        "origin": "sourced",
        "sources": [
          "X-cap-mandate-broker-002"
        ],
        "quote": "Scope can be used to decrease privileges carried by the input tokens."
      },
      {
        "name": "attach",
        "input": "an ordinary outbound request made by a unit of work, plus the handle minted for that request's destination",
        "output": "the request as it leaves the host, with the real credential added outside the sandbox and with destination and model override fields dropped by name",
        "origin": "sourced",
        "sources": [
          "X-cap-mandate-broker-007",
          "F-a3-08"
        ],
        "quote": "each proxy attaches the real token at the network layer"
      },
      {
        "name": "issue_mandate",
        "input": "an approving actor's signature over the bounds of one action class: a ceiling, the destinations it may be used against, and the period it is valid for",
        "output": "a signed, expiring, scope-limited mandate record carrying exactly those bounds and nothing about how the work will be judged",
        "origin": "sourced",
        "sources": [
          "X-end-to-end-070"
        ],
        "quote": "Every agent operates under a Mandate that specifies spending limits, allowed merchants, and validity periods."
      },
      {
        "name": "verify_mandate",
        "input": "a mandate and the single action about to be taken under it",
        "output": "accept, or a typed refusal naming which bound failed; the decision is reachable by a party that did not issue the mandate, without contacting the issuer",
        "origin": "sourced",
        "sources": [
          "X-cap-mandate-broker-005"
        ],
        "quote": "verification doesn't depend on contacting the issuer"
      }
    ],
    "shapes": [
      {
        "name": "credential-handle (proposed summary shape; the mint request, the refusal members and the full mandate record are in references/mandate-broker-shapes.md)",
        "origin": "proposed",
        "schema": {
          "$schema": "https://json-schema.org/draft/2020-12/schema",
          "$id": "urn:agentic:cap:mandate-broker:handle:0.1",
          "type": "object",
          "additionalProperties": false,
          "required": [
            "handle_id",
            "audience",
            "scope",
            "expires_at",
            "actor"
          ],
          "properties": {
            "handle_id": {
              "type": "string",
              "minLength": 8,
              "description": "Proposed: what a unit of work holds instead of a credential. Opaque, useless at any destination, and safe to log."
            },
            "audience": {
              "type": "string",
              "minLength": 1,
              "description": "Proposed: the one destination identifier this authority is for. Exactly one; a list would make replay a configuration choice."
            },
            "scope": {
              "type": "array",
              "items": {
                "type": "string",
                "minLength": 1
              },
              "description": "Proposed: never wider than the scope of the identity it was exchanged from."
            },
            "expires_at": {
              "type": "string",
              "format": "date-time"
            },
            "refreshable": {
              "const": false,
              "description": "Proposed: a const so no caller can ask for a longer-lived authority."
            },
            "actor": {
              "type": "string",
              "pattern": "^(user|service|agent|schedule):[a-z0-9][a-z0-9._@-]*$"
            },
            "correlation_id": {
              "type": "string",
              "minLength": 1
            }
          }
        }
      },
      {
        "name": "mandate (proposed summary shape; the signature members, the bounds vocabulary and the verification outcome are in references/mandate-broker-shapes.md)",
        "origin": "proposed",
        "schema": {
          "$schema": "https://json-schema.org/draft/2020-12/schema",
          "$id": "urn:agentic:cap:mandate-broker:mandate:0.1",
          "type": "object",
          "additionalProperties": false,
          "required": [
            "mandate_id",
            "approved_by",
            "action_class",
            "bounds",
            "not_before",
            "not_after",
            "signature"
          ],
          "properties": {
            "mandate_id": {
              "type": "string",
              "minLength": 8
            },
            "approved_by": {
              "type": "string",
              "pattern": "^(user|service|agent):[a-z0-9][a-z0-9._@-]*$"
            },
            "action_class": {
              "type": "string",
              "enum": [
                "spend",
                "deploy",
                "send"
              ],
              "description": "Proposed: the irreversible classes this platform mandates. Anything else is a scoped credential, not a mandate."
            },
            "bounds": {
              "type": "object",
              "additionalProperties": false,
              "required": [
                "destinations"
              ],
              "properties": {
                "ceiling_micros": {
                  "type": "integer",
                  "minimum": 0